{
  "schema_version": 3,
  "created_with": "design-dna 4.0.0",
  "classification": "internal",
  "study": {
    "id": "alder-reach-ten-forms",
    "title": "Alder Reach source-frozen route family",
    "requested_route_count": 10
  },
  "shared_contract": {
    "identity": "Alder Reach wordmark, one plain navigator, thin rule, and clearly fictional fixture voice.",
    "navigation": "Ten destination labels remain in the same relative order with current-page state and a first-focus skip link.",
    "truth": "Every statement is visibly labeled fictional fixture copy; no outside place, person, metric, or endorsement is implied.",
    "accessibility": "Semantic landmarks, logical headings, keyboard links, visible focus, reflow, and source-visible content are shared.",
    "voice": "Concrete observational English; route cadence may change but invented quotations and authority claims are prohibited.",
    "performance": "Local HTML and CSS are the complete baseline; enhancements may not block navigation or content."
  },
  "routes": [
    {
      "id": "cover",
      "path": "/",
      "title": "Alder Reach: ten ways in",
      "user_job": "Understand the anthology and choose a useful route.",
      "observable_decisions": [
        {
          "decision": "Present the supplied route choices as the main body rather than hiding them behind a generic promotional introduction.",
          "reason": "The reader's immediate job is to understand the available documents and choose one.",
          "evidence": "index.html and its ten direct destination links.",
          "status": "accepted",
          "source_rank": 1,
          "source_id": "strong-1",
          "source_observation": ".design-dna/references/strong-1-observation.json",
          "source_sha256": "38ef29c8459eaf1644a5f4ae4240de9709806c005056f06254fa7200c4ab37e4",
          "source_state_id": "rest"
        }
      ],
      "responsive_result": "The supplied ledger becomes one continuous numbered reading column while labels and destinations remain complete.",
      "reduced_motion_result": "The cover is an identical static document.",
      "no_javascript_result": "The complete contents and ordinary links remain available.",
      "closest_sibling": "visit",
      "deliberate_differences": [
        "Cover prioritizes discovery rather than logistics.",
        "Cover exposes the route ledger before the short note; Visit groups preparation information."
      ],
      "capture_requirements": {
        "viewports": [
          {
            "id": "desktop",
            "width": 1440
          },
          {
            "id": "mobile",
            "width": 390
          }
        ]
      },
      "review_status": "implemented",
      "source_mapping": {
        "rank": 1,
        "id": "strong-1",
        "observation": ".design-dna/references/strong-1-observation.json",
        "sha256": "38ef29c8459eaf1644a5f4ae4240de9709806c005056f06254fa7200c4ab37e4"
      },
      "component_sources": [
        {
          "component": "tag:main",
          "source_rank": 1,
          "source_id": "strong-1",
          "source_observation": ".design-dna/references/strong-1-observation.json",
          "source_sha256": "38ef29c8459eaf1644a5f4ae4240de9709806c005056f06254fa7200c4ab37e4",
          "source_state_id": "rest",
          "transfer": "The route main content copies the exact selected reference state structure."
        }
      ]
    },
    {
      "id": "field-notes",
      "path": "/field-notes/",
      "title": "Field notes",
      "user_job": "Read short observations organized by place and time.",
      "observable_decisions": [
        {
          "decision": "Keep metadata and specimen context adjacent to the note they qualify.",
          "reason": "Separating those labels would make the short observations ambiguous.",
          "evidence": "field-notes/index.html metadata, note entries, and specimen aside.",
          "status": "accepted",
          "source_rank": 1,
          "source_id": "strong-1",
          "source_observation": ".design-dna/references/strong-1-observation.json",
          "source_sha256": "38ef29c8459eaf1644a5f4ae4240de9709806c005056f06254fa7200c4ab37e4",
          "source_state_id": "rest"
        }
      ],
      "responsive_result": "Margin metadata moves above its related note without changing reading order.",
      "reduced_motion_result": "The journal is static and its anchors remain visible.",
      "no_javascript_result": "All entries and anchors remain available.",
      "closest_sibling": "oral-history",
      "deliberate_differences": [
        "Field Notes contains observer-authored fragments; Oral History contains an alternating fictional conversation.",
        "Specimen context stays with entries while transcript notes stay with speakers."
      ],
      "capture_requirements": {
        "viewports": [
          {
            "id": "desktop",
            "width": 1440
          },
          {
            "id": "mobile",
            "width": 390
          }
        ]
      },
      "review_status": "implemented",
      "source_mapping": {
        "rank": 1,
        "id": "strong-1",
        "observation": ".design-dna/references/strong-1-observation.json",
        "sha256": "38ef29c8459eaf1644a5f4ae4240de9709806c005056f06254fa7200c4ab37e4"
      },
      "component_sources": [
        {
          "component": "tag:main",
          "source_rank": 1,
          "source_id": "strong-1",
          "source_observation": ".design-dna/references/strong-1-observation.json",
          "source_sha256": "38ef29c8459eaf1644a5f4ae4240de9709806c005056f06254fa7200c4ab37e4",
          "source_state_id": "rest",
          "transfer": "The route main content copies the exact selected reference state structure."
        }
      ]
    },
    {
      "id": "timeline",
      "path": "/timeline/",
      "title": "A made-up century",
      "user_job": "Follow the fictional settlement sequence in chronological order.",
      "observable_decisions": [
        {
          "decision": "Place the fictional-source notice before dated material and provide both states of the plan comparison in text.",
          "reason": "Chronology must not obscure provenance or make the comparison depend on a control.",
          "evidence": "timeline/index.html source notice, dated entries, comparator, and text alternative.",
          "status": "accepted",
          "source_rank": 1,
          "source_id": "strong-1",
          "source_observation": ".design-dna/references/strong-1-observation.json",
          "source_sha256": "38ef29c8459eaf1644a5f4ae4240de9709806c005056f06254fa7200c4ab37e4",
          "source_state_id": "rest"
        }
      ],
      "responsive_result": "The two plan states become sequential figures when the side-by-side control would no longer be useful.",
      "reduced_motion_result": "Both comparison states are shown without animation.",
      "no_javascript_result": "Both plans and every dated event remain visible.",
      "closest_sibling": "night-walk",
      "deliberate_differences": [
        "Timeline organizes evidence by date; Night Walk follows a supplied sensory route.",
        "Timeline centers source status and plan comparison rather than scene-sized chapters."
      ],
      "capture_requirements": {
        "viewports": [
          {
            "id": "desktop",
            "width": 1440
          },
          {
            "id": "mobile",
            "width": 390
          }
        ]
      },
      "review_status": "implemented",
      "source_mapping": {
        "rank": 1,
        "id": "strong-1",
        "observation": ".design-dna/references/strong-1-observation.json",
        "sha256": "38ef29c8459eaf1644a5f4ae4240de9709806c005056f06254fa7200c4ab37e4"
      },
      "component_sources": [
        {
          "component": "tag:main",
          "source_rank": 1,
          "source_id": "strong-1",
          "source_observation": ".design-dna/references/strong-1-observation.json",
          "source_sha256": "38ef29c8459eaf1644a5f4ae4240de9709806c005056f06254fa7200c4ab37e4",
          "source_state_id": "rest",
          "transfer": "The route main content copies the exact selected reference state structure."
        }
      ]
    },
    {
      "id": "listening-map",
      "path": "/listening-map/",
      "title": "A listening map",
      "user_job": "Choose a public listening point by sound and access needs.",
      "observable_decisions": [
        {
          "decision": "Keep the complete place list before the optional map and update a labeled detail region from either entry method.",
          "reason": "Selection and access information must survive when the diagram or enhancement is unavailable.",
          "evidence": "listening-map/index.html place list, map controls, detail region, and access note.",
          "status": "accepted",
          "source_rank": 1,
          "source_id": "strong-1",
          "source_observation": ".design-dna/references/strong-1-observation.json",
          "source_sha256": "38ef29c8459eaf1644a5f4ae4240de9709806c005056f06254fa7200c4ab37e4",
          "source_state_id": "rest"
        }
      ],
      "responsive_result": "The place list becomes primary and the diagram follows as optional context.",
      "reduced_motion_result": "Marker changes occur without animated travel.",
      "no_javascript_result": "The complete place list and descriptions remain visible.",
      "closest_sibling": "visit",
      "deliberate_differences": [
        "Listening Map supports spatial selection; Visit supports sequenced preparation.",
        "Map detail changes in place while Visit exposes grouped static logistics."
      ],
      "capture_requirements": {
        "viewports": [
          {
            "id": "desktop",
            "width": 1440
          },
          {
            "id": "mobile",
            "width": 390
          }
        ]
      },
      "review_status": "implemented",